{"report_id":"weekly:0c6015e0-d58c-46a6-b297-9232972e4686:1:7","schema_version":"press.article/0.1-draft","sections":[{"blocks":[{"fact_ids":["match:m01-00062","performance:m01-00062:real::antoine-griezmann","performance:m01-00062:real::youri-tielemans","before:m01-00062:team-star-guardians","before:m01-00062:team-xeno-hunters","streak:m01-00062:team-star-guardians:all_official:unbeaten","streak:m01-00062:team-star-guardians:league_all_levels:unbeaten"],"kind":"body","label":null,"text":"赛前排名第三的 Star Guardians 坐镇星穹守望球场，迎战第十的 Xeno Hunters。开场仅 4 分钟，安托万·格列兹曼便为客队破门；第 51 分钟，尤里·蒂勒曼斯扩大比分；格列兹曼又在第 67 分钟和第 89 分钟两度建功，完成帽子戏法。Xeno Hunters 以 4-0 带走胜利。这场失利终结了 Star Guardians 在各项正式赛事中持续五场的不败纪录，同一波不败在联赛范围内同样停在五场。"}],"heading":"格列兹曼三球终结星穹守望不败","heading_fact_ids":["match:m01-00062","performance:m01-00062:real::antoine-griezmann","streak:m01-00062:team-star-guardians:all_official:unbeaten"]},{"blocks":[{"fact_ids":["match:m01-00070","performance:m01-00070:real::dominik-szoboszlai","streak:m01-00070:team-yellowjackets-fc:all_official:wins","streak:m01-00070:team-yellowjackets-fc:league_all_levels:wins","streak:m01-00070:team-yellowjackets-fc:all_official:unbeaten","table:premier:team-yellowjackets-fc"],"kind":"body","label":null,"text":"Yellowjackets FC 客场挑战 Celestial Vanguard。多米尼克·索博斯洛伊第 10 分钟首开纪录，第 23 分钟客队再入一球；主队第 36 分钟扳回一分后，Yellowjackets 随即回应，索博斯洛伊第 83 分钟完成个人第二球，将比分锁定为 4-1。此役过后，Yellowjackets 在各项正式赛事中取得五连胜，联赛范围内同样是五连胜，且延续不败。七轮战罢，他们以 18 分升至 Premier Division 榜首。"}],"heading":"黄色夹克五连胜登上榜首","heading_fact_ids":["match:m01-00070","streak:m01-00070:team-yellowjackets-fc:all_official:wins","table:premier:team-yellowjackets-fc"]},{"blocks":[{"fact_ids":["match:m01-00064","performance:m01-00064:real::victor-osimhen","performance:m01-00064:real::sandro-tonali","table:premier:team-hannya-masks","table:premier:team-northern-lords"],"kind":"body","label":null,"text":"Hannya Masks 主场对阵 Dark Side of the Moon，维克托·奥西姆亨在第 10、59、83 分钟三度破门，桑德罗·托尼利第 89 分钟锦上添花，主队以 5-2 取胜。奥西姆亨全场完成 3 次射正得分，还送出 3 次机会创造。Hannya Masks 以 16 分排名第二，与 Northern Lords 同分。"}],"heading":"奥西姆亨戴帽，Hannya Masks 紧追不舍","heading_fact_ids":["match:m01-00064","performance:m01-00064:real::victor-osimhen","table:premier:team-hannya-masks"]},{"blocks":[{"fact_ids":["match:m01-00446","before:m01-00446:team-gaia-s-revenge","before:m01-00446:team-thunder-rangers","streak:m01-00446:team-gaia-s-revenge:all_official:winless","streak:m01-00446:team-gaia-s-revenge:league_all_levels:winless","table:second:team-gaia-s-revenge"],"kind":"body","label":null,"text":"Second Division 排名第十九的 Gaia's Revenge 主场迎战第十二的 Thunder Rangers。Gaia's Revenge 在第 10 分钟和第 23 分钟各入一球，以 2-0 拿下比赛。此前他们在各项正式赛事中连续六场不胜，联赛范围内同样六场不胜，这一纪录就此终结。他们目前积 5 分，仍列第十六位。"}],"heading":"Gaia's Revenge 六场不胜后终取首胜","heading_fact_ids":["match:m01-00446","streak:m01-00446:team-gaia-s-revenge:all_official:winless"]},{"blocks":[{"fact_ids":["match:m01-00449","streak:m01-00449:team-pain-fc:all_official:wins","streak:m01-00449:team-pain-fc:league_all_levels:wins","table:second:team-pain-fc","match:m01-00444","streak:m01-00444:team-shadow-eaters:all_official:wins","table:second:team-shadow-eaters","match:m01-00445","streak:m01-00445:team-miracle-makers:all_official:unbeaten","table:second:team-miracle-makers"],"kind":"body","label":null,"text":"Pain FC 主场 2-0 击败 Ruined Legion，在各项正式赛事中取得六连胜，联赛范围内同样六连胜，并以 19 分继续领跑 Second Division。Shadow Eaters 客场 2-2 战平 Crownfield Athletic，五连胜就此终结，但仍以 16 分位居第二。Miracle Makers 主场 0-1 不敌 Sentinels of Light，六场不败告终，目前以 14 分排名第三。"},{"fact_ids":["match:m01-00062","performance:m01-00062:real::antoine-griezmann","streak:m01-00062:team-star-guardians:all_official:unbeaten","match:m01-00070","streak:m01-00070:team-yellowjackets-fc:all_official:wins","table:premier:team-yellowjackets-fc"],"kind":"media_comment","label":"媒体评论（虚构）","text":"「星穹守望球场的那五场不败像一层薄冰，格列兹曼第四分钟的进球就把它踩裂了。同一轮里，黄色夹克把连胜攒到了五场——榜首换人的时候，没人会记得第七轮之前谁排第一。」"}],"heading":"次级联赛：Pain FC 六连胜领跑，Shadow Eaters 连胜终结","heading_fact_ids":["match:m01-00449","streak:m01-00449:team-pain-fc:all_official:wins","match:m01-00444","streak:m01-00444:team-shadow-eaters:all_official:wins"]}],"summary":"第七周，Xeno Hunters 在客场以 4-0 大胜此前五场不败的 Star Guardians，格列兹曼上演帽子戏法；Yellowjackets FC 则延续连胜，登上 Premier Division 榜首。Second Division 中，Gaia's Revenge 以 2-0 击败 Thunder Rangers，取得赛季首胜。","summary_fact_ids":["match:m01-00062","performance:m01-00062:real::antoine-griezmann","streak:m01-00062:team-star-guardians:all_official:unbeaten","match:m01-00070","table:premier:team-yellowjackets-fc","match:m01-00446","streak:m01-00446:team-gaia-s-revenge:all_official:winless"],"title":"格列兹曼戴帽掀翻星穹守望，黄色夹克登顶榜首","title_fact_ids":["match:m01-00062","performance:m01-00062:real::antoine-griezmann","table:premier:team-yellowjackets-fc"],"used_topic_ids":["topic:upset:m01-00062","topic:standout:real::antoine-griezmann:m01-00062","topic:streak:team-star-guardians:all_official:unbeaten:m01-00062","topic:standout:real::dominik-szoboszlai:m01-00070","topic:streak:team-yellowjackets-fc:league_all_levels:wins:m01-00070","topic:standout:real::victor-osimhen:m01-00064","topic:upset:m01-00446","topic:streak:team-gaia-s-revenge:all_official:winless:m01-00446"]}
